foundation_id,name,legal_type,regulator,country,city,website,application_url,support_areas,applicant_types,deadline_model,notes,source_url,last_checked,verification_status
nordea-fonden,Nordea-fonden,Erhvervsdrivende fond,Erhvervsstyrelsen,Danmark,København,https://nordeafonden.dk,https://nordeafonden.dk/soeg-stoette,"Sundhed; motion; natur; kultur; fællesskaber; gode liv","Foreninger; organisationer; institutioner; lokale projekter",Løbende og puljer,"Filantropisk fond med fokus på gode liv i Danmark.",https://nordeafonden.dk/soeg-stoette,2026-06-08,to_verify
trygfonden,TrygFonden,Almennyttig fond/fondslignende,To verify,Danmark,Kgs. Lyngby,https://tryghed.dk,https://tryghed.dk/sog-stotte,"Tryghed; sundhed; sikkerhed; trivsel; forskning; beredskab","Organisationer; institutioner; NGO'er; frivillige; forskere",Løbende og landsdækkende puljer,"Støtter ikke privatpersoner og ikke kommercielle, politiske eller religiøse projekter.",https://tryghed.dk/sog-stotte,2026-06-08,source_checked
villum-fonden,VILLUM FONDEN,Erhvervsdrivende fond,Erhvervsstyrelsen,Danmark,Søborg,https://veluxfoundations.dk/da/group/foundation/villum-fonden,https://veluxfoundations.dk/da/group/foundation/villum-fonden,"Teknisk og naturvidenskabelig forskning; miljø og klima; børn unge og science; unge og uddannelse; kultur og samfund","Forskere; institutioner; organisationer; projekter efter opslag",Opslag/calls,"Relevant ved opslag om unge, uddannelse, miljø og klima.",https://veluxfoundations.dk/da/group/foundation/villum-fonden,2026-07-02,source_checked
velux-fonden,VELUX FONDEN,Almennyttig fond/fondslignende,To verify,Danmark,Søborg,https://veluxfoundations.dk/da/group/foundation/velux-fonden,https://veluxfoundations.dk/da/group/foundation/velux-fonden,"Demokratisk bæredygtighed; sociale indsatser; human- og samfundsvidenskab; havmiljø","Forskere; praktikere; institutioner; organisationer; projekter efter opslag",Opslag/calls,"Stærkt match ved opslag om demokratisk bæredygtighed og sociale indsatser.",https://veluxfoundations.dk/da/group/foundation/velux-fonden,2026-07-02,source_checked
bikubenfonden,Bikubenfonden,Erhvervsdrivende fond,Erhvervsstyrelsen,Danmark,København,https://www.bikubenfonden.dk,https://www.bikubenfonden.dk/soeg-stoette,"Billedkunst; scenekunst; unge på kanten; sociale forandringer","Kunstnere; kulturinstitutioner; sociale organisationer; projekter efter opslag",Opslag/calls,"Fokus på kunst og sociale indsatser.",https://www.bikubenfonden.dk/soeg-stoette,2026-06-08,to_verify
tuborgfondet,Tuborgfondet,Almennyttig fond/fondslignende,To verify,Danmark,København,https://www.tuborgfondet.dk,https://www.tuborgfondet.dk/soeg-stotte/,"Unge; fællesskaber; demokrati; grøn omstilling; civilsamfund","Unge; foreninger; organisationer; lokale initiativer",Løbende og puljer,"Fokus på unges engagement og handlekraft.",https://www.tuborgfondet.dk/soeg-stotte/,2026-06-08,to_verify
egmont-fonden,Egmont Fonden,Erhvervsdrivende fond,Erhvervsstyrelsen,Danmark,København,https://www.egmontfonden.dk,https://www.egmontfonden.dk/ansoegning,"Børn og unge; udsathed; læring; trivsel; social mobilitet","Organisationer; institutioner; projekter efter opslag",Opslag/calls,"Fokus på børn og unge i udsatte positioner.",https://www.egmontfonden.dk/ansoegning,2026-06-08,to_verify
lauritzen-fonden,Lauritzen Fonden,Erhvervsdrivende fond,Erhvervsstyrelsen,Danmark,Hellerup,https://lauritzenfonden.com,https://lauritzenfonden.com/ansoegning/,"Udsatte børn og unge; maritimt; uddannelse; kultur; humanitære indsatser","Organisationer; institutioner; projekter",Løbende og opslag,"Har historisk maritime rødder og bred almennyttig uddeling.",https://lauritzenfonden.com/ansoegning/,2026-06-08,to_verify
ole-kirks-fond,Ole Kirk's Fond,Almennyttig fond/fondslignende,To verify,Danmark,Billund,https://olekirksfond.dk,https://olekirksfond.dk/ansoegning/,"Børn; familier; trivsel; leg; læring; sociale indsatser","Organisationer; institutioner; projekter",Løbende og opslag,"Fokus på børns og familiers muligheder.",https://olekirksfond.dk/ansoegning/,2026-06-08,to_verify
kr-foundation,KR Foundation,Almennyttig fond/fondslignende,To verify,Danmark,København,https://krfnd.org,https://krfnd.org/apply-for-funding/,"Klima; bæredygtighed; systemforandring; adfærd; policy","Organisationer; NGO'er; internationale partnerskaber",Opslag/invitation,"International klimafond med dansk base.",https://krfnd.org/apply-for-funding/,2026-06-08,to_verify
duf,Dansk Ungdoms Fællesråd (DUF),Paraplyorganisation/fondslignende puljeaktør,Ikke relevant/forening,Danmark,København,https://duf.dk,https://duf.dk/tilskud-puljer/initiativstoetten/,"Unge; demokratisk dannelse; demokratisk selvtillid; frivillighed; foreningsliv; klima og biodiversitet","Foreninger; projektgrupper; privatpersoner; frivilligdrevne initiativer",Puljer med faste frister,"Initiativstøtten er et kernematch for projekter af, for og med børn og unge.",https://duf.dk/tilskud-puljer/initiativstoetten/,2026-07-02,source_checked
oestifterne,Østifterne,Forening/fondslignende filantropisk aktør,Ikke relevant/forening,Danmark,,https://www.oestifterne.dk,https://www.oestifterne.dk/uddelinger/uddelingspuljer/,"Lokale fællesskaber; deltagelse; trivsel; social forandring; skadeforebyggelse","Foreninger; organisationer; almennyttige initiativer",Løbende og puljer,"Relevant for fællesskab, deltagelse og social innovation; konkrete puljekriterier skal matche.",https://www.oestifterne.dk/uddelinger/uddelingspuljer/,2026-07-02,source_checked
lb-foreningen,LB Foreningen,Forening/fondslignende filantropisk aktør,Ikke relevant/forening,Danmark,København,https://www.lbforeningen.dk,https://www.lbforeningen.dk/soeg-stoette,"Fællesskaber; demokrati; bæredygtighed; socialt udsatte; frivillighed","Foreninger; organisationer; nationale regionale og lokale projekter",Regionale og nationale uddelinger,"Direkte match på demokrati, bæredygtighed og frivilligt funderede fællesskaber.",https://www.lbforeningen.dk/soeg-stoette,2026-07-02,source_checked
nordjyllandsfonden,Nordjyllandsfonden,Erhvervsdrivende fond,Erhvervsstyrelsen,Danmark,Aalborg,https://www.nordjyllandsfonden.dk,https://www.nordjyllandsfonden.dk/ansoeg,"Fællesskaber; kultur; fritid; sociale indsatser; børn og unge; frivillighed","Foreninger; organisationer; lokale regionale og nationale projekter",Løbende og uddelingsrunder,"Trods navnet støtter fonden projekter i hele Danmark; match er stærkest ved involverende fællesskaber.",https://www.nordjyllandsfonden.dk/ansoeg,2026-07-02,source_checked
velliv-foreningen,Velliv Foreningen,Forening/fondslignende filantropisk aktør,Ikke relevant/forening,Danmark,Ballerup,https://www.vellivforeningen.dk,https://www.vellivforeningen.dk/soeg-stoette,"Mental sundhed; unge i overgangen til arbejdslivet; civilsamfund; fællesskaber; offentlig debat","Civilsamfundsorganisationer; arbejdspladser; organisationer; forskere",Løbende og puljer,"Relevant for projekter om unges mentale sundhed og overgang til første job.",https://www.vellivforeningen.dk/soeg-stoette,2026-07-02,source_checked
noerrebro-lokaludvalg,Nørrebro Lokaludvalg,Kommunalt lokaludvalg,Københavns Kommune,Danmark,København N,https://noerrebrolokaludvalg.kk.dk,https://noerrebrolokaludvalg.kk.dk/soeg-penge/,"Lokaldemokrati; borgerinddragelse; netværk; sociale og kulturelle ressourcer; klima; social bæredygtighed","Foreninger; projektgrupper; lokale aktører; borgere",Faste runder og mindre pulje,"Projekter skal foregå på eller tydeligt gavne Nørrebro og helst have lokal forankring.",https://noerrebrolokaludvalg.kk.dk/soeg-penge/,2026-07-02,source_checked
frederiksberg-kommune,Frederiksberg Kommune,Kommunal puljeaktør,Frederiksberg Kommune,Danmark,Frederiksberg,https://www.frederiksberg.dk,https://www.frederiksberg.dk/fritid-og-oplevelser/tilskud-fra-puljer,"Kultur; fritid; fællesskaber; offentlige aktiviteter; børn og unge","Foreninger; organisationer; projektgrupper; borgere",Løbende og faste runder,"Projekter skal normalt finde sted på Frederiksberg og være offentligt tilgængelige eller målrettet relevante grupper.",https://www.frederiksberg.dk/fritid-og-oplevelser/tilskud-fra-puljer,2026-07-02,source_checked
koebenhavns-kommune,Københavns Kommune,Kommunal puljeaktør,Københavns Kommune,Danmark,København,https://www.kk.dk,https://www.kk.dk/brug-byen/kultur-og-projektstoette,"Unge; ungdomsdemokrati; foreningsudvikling; frivilligt socialt arbejde; kultur; mangfoldighed","Foreninger; organisationer; unge; frivillige initiativer",Løbende og faste runder,"Kun programmer med direkte match til Sustainarys unge- og civilsamfundsarbejde er medtaget.",https://www.kk.dk/brug-byen/kultur-og-projektstoette,2026-07-02,source_checked
